{
  "schemaVersion": 1,
  "rolloutProfile": "PERSONAL_LOCAL",
  "contractGitCommit": "aaaaaaaaaaaaaaaaaaaaaaaaaaaaaaaaaaaaaaaa",
  "authorityBaseline": "48867ada7a38e551098b5c698ddfefc899d9b09e",
  "environmentName": "test",
  "clusterName": "atlas-test",
  "kubeContext": "kind-atlas-test",
  "kubeconfigPath": "/fixture/not-a-real-host/atlas-test.kubeconfig",
  "kubeconfigSHA256": "3333333333333333333333333333333333333333333333333333333333333333",
  "kubectlPath": "/fixture/not-a-real-host/kubectl",
  "kubectlSHA256": "2222222222222222222222222222222222222222222222222222222222222222",
  "kubectlVersion": "1.36.3",
  "kubernetesVersion": "1.36.1",
  "apiServerURL": "https://127.0.0.1:6443",
  "kubeSystemNamespaceUID": "00000000-0000-4000-8000-000000000001",
  "apiServerCASPKISHA256": "1111111111111111111111111111111111111111111111111111111111111111",
  "repositoryURL": "https://github.com/snkio027/atlas.git",
  "waiverDecisionSHA256": "34e42bc31933ecf63fa5d878b611c3119415c3503481c7863e5e1cb5a4eff949",
  "ownerGateState": "NOT_AUTHORIZED",
  "ownerGateSHA256": "dbb62b37538b65bb3c2f5c293d38efab3050a36b697674c42fb9d6407da074ee",
  "ownerGateTargetProjectionSHA256": "aaaaaaaaaaaaaaaaaaaaaaaaaaaaaaaaaaaaaaaaaaaaaaaaaaaaaaaaaaaaaaaa",
  "targetFingerprintSHA256": "d6af702bd1024fd5dc03efb440c1f71e0b9010f960d905e18b8600e74418ad4f",
  "desiredObjects": [
    {"apiVersion": "v1", "kind": "Namespace", "namespace": "", "name": "kube-system", "desiredProjectionSHA256": "f4932b1d7977365b84ee0bee557932e860b4368df9a0a206bb28efa8d831d09f"},
    {"apiVersion": "v1", "kind": "ConfigMap", "namespace": "argocd", "name": "argocd-cm", "desiredProjectionSHA256": "da76d4e8240df8078094eaeb7c2bcb0798bb6c86898ec9963af0fded34deb6df"},
    {"apiVersion": "v1", "kind": "ConfigMap", "namespace": "argocd", "name": "argocd-rbac-cm", "desiredProjectionSHA256": "0bab258e2161728aac34459e94dd8980333272684908d16b9ef1e268cbb2df56"},
    {"apiVersion": "v1", "kind": "ConfigMap", "namespace": "argocd", "name": "argocd-cmd-params-cm", "desiredProjectionSHA256": "85d77b8491c915530be75b0793f03d86d712577cf45d7fadab7743491e470d01"},
    {"apiVersion": "argoproj.io/v1alpha1", "kind": "Application", "namespace": "argocd", "name": "argocd-self", "desiredProjectionSHA256": "024d23442e79482623b3b7425c685696985797614390ee62902a66366eb70b8f"},
    {"apiVersion": "argoproj.io/v1alpha1", "kind": "AppProject", "namespace": "argocd", "name": "atlas-bootstrap", "desiredProjectionSHA256": "4b6e3c07872fe71462ae22488f283f155ff7d4436adb2bdb670d8250b5211a6f"},
    {"apiVersion": "argoproj.io/v1alpha1", "kind": "AppProject", "namespace": "argocd", "name": "platform-project", "desiredProjectionSHA256": "b94563b7e7ab663b4d84015d6331c447c0776d766945b3c815e24a02115728f2"},
    {"apiVersion": "argoproj.io/v1alpha1", "kind": "AppProject", "namespace": "argocd", "name": "workload-project", "desiredProjectionSHA256": "775992ad545eda57917c370920d06693258e55f3cf3b71c4259e6602a3604d95"},
    {"apiVersion": "apps/v1", "kind": "Deployment", "namespace": "argocd", "name": "atlas-argocd-applicationset-controller", "desiredProjectionSHA256": "c15b6b909a12c3c4ca6804f6deb399bca436f686c28aba711e474d0e6f808175"},
    {"apiVersion": "apps/v1", "kind": "Deployment", "namespace": "argocd", "name": "atlas-argocd-redis", "desiredProjectionSHA256": "d5d7a5baad74db1c0d78f66a41f86370d2b22f32a87f920f634ac28b5611247b"},
    {"apiVersion": "apps/v1", "kind": "Deployment", "namespace": "argocd", "name": "atlas-argocd-repo-server", "desiredProjectionSHA256": "70ff2a986095b486c1103d99a30557881f725df89e3e9cb967ce5ad4b458db77"},
    {"apiVersion": "apps/v1", "kind": "Deployment", "namespace": "argocd", "name": "atlas-argocd-server", "desiredProjectionSHA256": "fdf58e448b5fa0ab7db9b33e9b3af1fbe5bdb4c5edaf2588d7a5a6c6f7803935"},
    {"apiVersion": "apps/v1", "kind": "StatefulSet", "namespace": "argocd", "name": "atlas-argocd-application-controller", "desiredProjectionSHA256": "d0eaff2f6fe1ac8e95ee56aaeafaffd64e3ee52137221c54cd4a447f187f5a02"}
  ],
  "desiredProjectionSHA256": "4985afebe6471eaf45c897ec372f91caeeca1cd171bf8901ee04aef4918ecd6c",
  "approvedTargetDocumentSHA256": "aaaaaaaaaaaaaaaaaaaaaaaaaaaaaaaaaaaaaaaaaaaaaaaaaaaaaaaaaaaaaaaa"
}
